{"anchors":[{"chainId":"ch_c73d4be06acb3ab2","id":"X1","memberNids":["X1"],"mp":10.0,"sMm":342624,"source":"crossing","tier":"posted"},{"chainId":"ch_c73d4be06acb3ab2","id":"M1","memberNids":["M1"],"mp":10.21,"sMm":685249,"source":"markerpost","tier":"unverified"},{"chainId":"ch_c73d4be06acb3ab2","id":"X2","memberNids":["X2"],"mp":11.7,"sMm":3083620,"source":"crossing","tier":"posted"},{"chainId":"ch_c73d4be06acb3ab2","id":"X9","memberNids":["X9"],"mp":12.55,"sMm":4454117,"source":"crossing","tier":"tc"},{"chainId":"ch_c73d4be06acb3ab2","id":"X3","memberNids":["X3","X3b"],"mp":13.83,"sMm":6513290,"source":"crossing","tier":"posted"},{"chainId":"ch_c73d4be06acb3ab2","id":"X6","memberNids":["X6"],"mp":18.09,"sMm":13362352,"source":"crossing","tier":"posted"},{"chainId":"ch_c73d4be06acb3ab2","id":"ST2","memberNids":["ST2"],"mp":18.22,"sMm":13567926,"source":"station","tier":"unverified"}],"assets":[{"attrs":{"TCID":"1011"},"id":"CROSSING.X11","kind":"crossing","latE6":[52100000],"layer":"CROSSING","lonE6":[-105985000],"name":null,"positions":[{"chainId":"ch_c73d4be06acb3ab2","derivedMpEnd":14.680294895855813,"derivedMpStart":14.680294895855813,"residualMm":0,"sEndMm":7880361,"sStartMm":7880361}],"posted":null},{"attrs":{"TCID":"1020"},"id":"CROSSING.X14","kind":"crossing","latE6":[52100000],"layer":"CROSSING","lonE6":[-105935000],"name":null,"positions":[{"chainId":"ch_c73d4be06acb3ab2","derivedMpEnd":16.81136035270231,"derivedMpStart":16.81136035270231,"residualMm":0,"sEndMm":11306605,"sStartMm":11306605}],"posted":null},{"attrs":{},"id":"CROSSING.X3","kind":"crossing","latE6":[52100000],"layer":"CROSSING","lonE6":[-106005000],"name":null,"positions":[{"chainId":"ch_c73d4be06acb3ab2","derivedMpEnd":13.827870368346904,"derivedMpStart":13.827870368346904,"residualMm":0,"sEndMm":6509864,"sStartMm":6509864}],"posted":{"mp":13.83,"subdivisionNid":"S1","tier":"posted"}},{"attrs":{},"id":"CROSSING.X3b","kind":"crossing","latE6":[52100000],"layer":"CROSSING","lonE6":[-106004900],"name":null,"positions":[{"chainId":"ch_c73d4be06acb3ab2","derivedMpEnd":13.832130913693,"derivedMpStart":13.832130913693,"residualMm":0,"sEndMm":6516716,"sStartMm":6516716}],"posted":{"mp":13.83,"subdivisionNid":"S1","tier":"posted"}},{"attrs":{},"id":"CROSSING.X4","kind":"crossing","latE6":[52100000],"layer":"CROSSING","lonE6":[-105965000],"name":null,"positions":[{"chainId":"ch_c73d4be06acb3ab2","derivedMpEnd":15.532721327387604,"derivedMpStart":15.532721327387604,"residualMm":0,"sEndMm":9250859,"sStartMm":9250859}],"posted":{"mp":15.54,"subdivisionNid":"S1","tier":"posted"}},{"attrs":{},"id":"CROSSING.X4b","kind":"crossing","latE6":[52100000],"layer":"CROSSING","lonE6":[-105965000],"name":null,"positions":[{"chainId":"ch_c73d4be06acb3ab2","derivedMpEnd":15.532721327387604,"derivedMpStart":15.532721327387604,"residualMm":0,"sEndMm":9250859,"sStartMm":9250859}],"posted":{"mp":16.04,"subdivisionNid":"S1","tier":"posted"}},{"attrs":{},"id":"CROSSING.X5","kind":"crossing","latE6":[52100000],"layer":"CROSSING","lonE6":[-105945000],"name":null,"positions":[{"chainId":"ch_c73d4be06acb3ab2","derivedMpEnd":16.385147136936414,"derivedMpStart":16.385147136936414,"residualMm":0,"sEndMm":10621356,"sStartMm":10621356}],"posted":{"mp":20.39,"subdivisionNid":"S1","tier":"posted"}},{"attrs":{},"id":"CROSSING.X6","kind":"crossing","latE6":[52100000],"layer":"CROSSING","lonE6":[-105905000],"name":null,"positions":[{"chainId":"ch_c73d4be06acb3ab2","derivedMpEnd":18.09,"derivedMpStart":18.09,"residualMm":0,"sEndMm":13362352,"sStartMm":13362352}],"posted":{"mp":18.09,"subdivisionNid":"S1","tier":"posted"}},{"attrs":{},"id":"CROSSING.X7","kind":"crossing","latE6":[52100000],"layer":"CROSSING","lonE6":[-105925000],"name":null,"positions":[{"chainId":"ch_c73d4be06acb3ab2","derivedMpEnd":17.237573568468207,"derivedMpStart":17.237573568468207,"residualMm":0,"sEndMm":11991854,"sStartMm":11991854}],"posted":null},{"attrs":{},"id":"JUNCTION.J1","kind":"diamond","latE6":[52100000],"layer":"JUNCTION","lonE6":[-106000000],"name":null,"positions":[{"chainId":"ch_c73d4be06acb3ab2","derivedMpEnd":14.04097538319846,"derivedMpStart":14.04097538319846,"residualMm":0,"sEndMm":6852488,"sStartMm":6852488}],"posted":null},{"attrs":{"STNENNAME":"Stn"},"id":"STATION.ST1","kind":"station","latE6":[52100000],"layer":"STATION","lonE6":[-105920000],"name":"Stn","positions":[{"chainId":"ch_c73d4be06acb3ab2","derivedMpEnd":17.450679865359664,"derivedMpStart":17.450679865359664,"residualMm":0,"sEndMm":12334478,"sStartMm":12334478}],"posted":null},{"attrs":{"STNENNAME":"Stn"},"id":"STATION.ST2","kind":"station","latE6":[52100000],"layer":"STATION","lonE6":[-105902000],"name":"Stn","positions":[{"chainId":"ch_c73d4be06acb3ab2","derivedMpEnd":18.22,"derivedMpStart":18.22,"residualMm":0,"sEndMm":13567926,"sStartMm":13567926}],"posted":{"mp":18.22,"subdivisionNid":"S1","tier":"unverified"}},{"attrs":{"STRUCTYPE":"Culvert"},"id":"STRUCTURE_0.CU","kind":"culvert","latE6":[52100100],"layer":"STRUCTURE_0","lonE6":[-105960000],"name":null,"positions":[{"chainId":"ch_c73d4be06acb3ab2","derivedMpEnd":15.745827624279062,"derivedMpStart":15.745827624279062,"residualMm":11127,"sEndMm":9593483,"sStartMm":9593483}],"posted":null},{"attrs":{"STRUCTYPE":"Bridge"},"id":"STRUCTURE_1.BR","kind":"bridge","latE6":[52100100,0],"layer":"STRUCTURE_1","lonE6":[-105990000,4000],"name":null,"positions":[{"chainId":"ch_c73d4be06acb3ab2","derivedMpEnd":14.637673512080925,"derivedMpStart":14.467188598964354,"residualMm":11127,"sEndMm":7811836,"sStartMm":7537737}],"posted":null}],"attribution":"Contains information licensed under the Open Government Licence – Canada.","bounds":{"east":-105.5,"north":52.25,"south":52.0,"west":-106.0},"bufferM":2000.0,"chains":[{"cycle":false,"id":"ch_c73d4be06acb3ab2","latE6":[52100000,0,0,0,0,0,0,0,0,0,0,0,0,0],"lonE6":[-106030000,10000,10000,10000,10000,10000,10000,10000,10000,10000,10000,10000,10000,10000],"operators":["CN"],"sMm":[4796742,685248,685249,685249,685249,685249,685248,685249,685249,685249,685249,685248,685249,685249],"subdivisionName":"Alpha","subdivisionNid":"S1","vertexStart":7}],"datasetVersion":"nrwn-2.0+cantre.0.1.0","intervals":[{"anchorIds":["X1","M1","X2","X9","X3","X6","ST2"],"chainId":"ch_c73d4be06acb3ab2","id":"ch_c73d4be06acb3ab2.i0"}],"key":"208_-212","schema":"cantre.tile/1","segments":[{"chainId":null,"key":"SD","latE6":[52100300,0],"lonE6":[-106100000,200000],"nid":"SD","operator":"CN","owner":"Owner","status":"Operational","subdivisionName":"Alpha","subdivisionNid":"S1","trackClass":"Siding","trackName":"None","useType":"Freight"},{"chainId":"ch_c73d4be06acb3ab2","key":"T1a","latE6":[52100000,0,0,0,0,0,0,0,0,0,0],"lonE6":[-106100000,10000,10000,10000,10000,10000,10000,10000,10000,10000,10000],"nid":"T1a","operator":"CN","owner":"Owner","status":"Operational","subdivisionName":"Alpha","subdivisionNid":"S1","trackClass":"Main","trackName":"None","useType":"Freight"},{"chainId":"ch_c73d4be06acb3ab2","key":"T1b","latE6":[52100000,0,0,0,0,0,0,0,0,0,0],"lonE6":[-106000000,10000,10000,10000,10000,10000,10000,10000,10000,10000,10000],"nid":"T1b","operator":"CN","owner":"Owner","status":"Operational","subdivisionName":"Alpha","subdivisionNid":"S1","trackClass":"Main","trackName":"None","useType":"Freight"}]}
