{"anchors":[{"chainId":"ch_25ba407aa1ab2ac2","id":"HL-X","memberNids":["HL-X"],"mp":5.0,"sMm":7444003,"source":"crossing","tier":"posted"}],"assets":[{"attrs":{},"id":"CROSSING.HL-X","kind":"crossing","latE6":[53400000],"layer":"CROSSING","lonE6":[-105985000],"name":null,"positions":[{"chainId":"ch_25ba407aa1ab2ac2","derivedMpEnd":null,"derivedMpStart":null,"residualMm":0,"sEndMm":7444003,"sStartMm":7444003}],"posted":{"mp":5.0,"subdivisionNid":"S7","tier":"posted"}}],"attribution":"Contains information licensed under the Open Government Licence – Canada.","bounds":{"east":-106.0,"north":53.5,"south":53.25,"west":-106.5},"bufferM":2000.0,"chains":[{"cycle":true,"id":"ch_25ba407aa1ab2ac2","latE6":[53400000,20000,0,-20000,0],"lonE6":[-106000000,0,30000,0,-30000],"operators":["CN"],"sMm":[0,2225879,1994518,2225879,1995453],"subdivisionName":"Eta","subdivisionNid":"S7","vertexStart":0}],"datasetVersion":"nrwn-2.0+cantre.0.1.0","intervals":[],"key":"213_-213","schema":"cantre.tile/1","segments":[{"chainId":"ch_25ba407aa1ab2ac2","key":"HL0","latE6":[53400000,0],"lonE6":[-106000000,30000],"nid":"HL0","operator":"CN","owner":"Owner","status":"Operational","subdivisionName":"Eta","subdivisionNid":"S7","trackClass":"Main","trackName":"None","useType":"Freight"},{"chainId":"ch_25ba407aa1ab2ac2","key":"HL1","latE6":[53400000,20000],"lonE6":[-105970000,0],"nid":"HL1","operator":"CN","owner":"Owner","status":"Operational","subdivisionName":"Eta","subdivisionNid":"S7","trackClass":"Main","trackName":"None","useType":"Freight"},{"chainId":"ch_25ba407aa1ab2ac2","key":"HL2","latE6":[53420000,0],"lonE6":[-106000000,30000],"nid":"HL2","operator":"CN","owner":"Owner","status":"Operational","subdivisionName":"Eta","subdivisionNid":"S7","trackClass":"Main","trackName":"None","useType":"Freight"},{"chainId":"ch_25ba407aa1ab2ac2","key":"HL3","latE6":[53400000,20000],"lonE6":[-106000000,0],"nid":"HL3","operator":"CN","owner":"Owner","status":"Operational","subdivisionName":"Eta","subdivisionNid":"S7","trackClass":"Main","trackName":"None","useType":"Freight"}]}
