{"anchors":[{"chainId":"ch_f415bf7b07a9b2c0","id":"I0","memberNids":["I0"],"mp":60.0,"sMm":329448,"source":"crossing","tier":"posted"},{"chainId":"ch_f415bf7b07a9b2c0","id":"I1","memberNids":["I1"],"mp":63.68,"sMm":6259521,"source":"crossing","tier":"tc"}],"assets":[{"attrs":{},"id":"CROSSING.I0","kind":"crossing","latE6":[53800000],"layer":"CROSSING","lonE6":[-105995000],"name":null,"positions":[{"chainId":"ch_f415bf7b07a9b2c0","derivedMpEnd":60.0,"derivedMpStart":60.0,"residualMm":0,"sEndMm":329448,"sStartMm":329448}],"posted":{"mp":60.0,"subdivisionNid":"S10","tier":"posted"}}],"attribution":"Contains information licensed under the Open Government Licence – Canada.","bounds":{"east":-106.0,"north":54.0,"south":53.75,"west":-106.5},"bufferM":2000.0,"chains":[{"cycle":false,"id":"ch_f415bf7b07a9b2c0","latE6":[53800000,0,0,0,0],"lonE6":[-106000000,10000,10000,10000,10000],"operators":["CN"],"sMm":[0,658897,658897,658897,658897],"subdivisionName":"Iota","subdivisionNid":"S10","vertexStart":0}],"datasetVersion":"nrwn-2.0+cantre.0.1.0","intervals":[{"anchorIds":["I0","I1"],"chainId":"ch_f415bf7b07a9b2c0","id":"ch_f415bf7b07a9b2c0.i0"}],"key":"215_-213","schema":"cantre.tile/1","segments":[{"chainId":"ch_f415bf7b07a9b2c0","key":"IT","latE6":[53800000,0,0,0,0,0,0,0,0,0,0],"lonE6":[-106000000,10000,10000,10000,10000,10000,10000,10000,10000,10000,10000],"nid":"IT","operator":"CN","owner":"Owner","status":"Operational","subdivisionName":"Iota","subdivisionNid":"S10","trackClass":"Main","trackName":"None","useType":"Freight"}]}
