{"anchors":[{"chainId":"ch_7b172cf1ca3270fa","id":"TA0","memberNids":["TA0"],"mp":80.0,"sMm":331014,"source":"crossing","tier":"posted"},{"chainId":"ch_7b172cf1ca3270fa","id":"TA1","memberNids":["TA1"],"mp":81.65,"sMm":2979126,"source":"crossing","tier":"posted"},{"chainId":"ch_e440f256cccd9906","id":"TB0","memberNids":["TB0"],"mp":3.0,"sMm":331014,"source":"crossing","tier":"posted"},{"chainId":"ch_e440f256cccd9906","id":"TB1","memberNids":["TB1"],"mp":4.65,"sMm":2979126,"source":"crossing","tier":"posted"}],"assets":[{"attrs":{},"id":"CROSSING.TA0","kind":"crossing","latE6":[53600000],"layer":"CROSSING","lonE6":[-105995000],"name":null,"positions":[{"chainId":"ch_7b172cf1ca3270fa","derivedMpEnd":80.0,"derivedMpStart":80.0,"residualMm":0,"sEndMm":331014,"sStartMm":331014}],"posted":{"mp":80.0,"subdivisionNid":"S8a","tier":"posted"}},{"attrs":{},"id":"CROSSING.TA1","kind":"crossing","latE6":[53600000],"layer":"CROSSING","lonE6":[-105955000],"name":null,"positions":[{"chainId":"ch_7b172cf1ca3270fa","derivedMpEnd":81.65,"derivedMpStart":81.65,"residualMm":0,"sEndMm":2979126,"sStartMm":2979126}],"posted":{"mp":81.65,"subdivisionNid":"S8a","tier":"posted"}},{"attrs":{},"id":"CROSSING.TB0","kind":"crossing","latE6":[53600000],"layer":"CROSSING","lonE6":[-105945000],"name":null,"positions":[{"chainId":"ch_e440f256cccd9906","derivedMpEnd":3.0,"derivedMpStart":3.0,"residualMm":0,"sEndMm":331014,"sStartMm":331014}],"posted":{"mp":3.0,"subdivisionNid":"S8b","tier":"posted"}},{"attrs":{},"id":"CROSSING.TB1","kind":"crossing","latE6":[53600000],"layer":"CROSSING","lonE6":[-105905000],"name":null,"positions":[{"chainId":"ch_e440f256cccd9906","derivedMpEnd":4.65,"derivedMpStart":4.65,"residualMm":0,"sEndMm":2979126,"sStartMm":2979126}],"posted":{"mp":4.65,"subdivisionNid":"S8b","tier":"posted"}}],"attribution":"Contains information licensed under the Open Government Licence – Canada.","bounds":{"east":-105.5,"north":53.75,"south":53.5,"west":-106.0},"bufferM":2000.0,"chains":[{"cycle":false,"id":"ch_7b172cf1ca3270fa","latE6":[53600000,0,0,0,0,0],"lonE6":[-106000000,10000,10000,10000,10000,10000],"operators":["CN"],"sMm":[0,662028,662028,662028,662028,662028],"subdivisionName":"Theta A","subdivisionNid":"S8a","vertexStart":0},{"cycle":false,"id":"ch_e440f256cccd9906","latE6":[53600000,0,0,0,0,0],"lonE6":[-105950000,10000,10000,10000,10000,10000],"operators":["CN"],"sMm":[0,662028,662028,662028,662028,662028],"subdivisionName":"Theta B","subdivisionNid":"S8b","vertexStart":0}],"datasetVersion":"nrwn-2.0+cantre.0.1.0","intervals":[{"anchorIds":["TA0","TA1"],"chainId":"ch_7b172cf1ca3270fa","id":"ch_7b172cf1ca3270fa.i0"},{"anchorIds":["TB0","TB1"],"chainId":"ch_e440f256cccd9906","id":"ch_e440f256cccd9906.i0"}],"key":"214_-212","schema":"cantre.tile/1","segments":[{"chainId":"ch_7b172cf1ca3270fa","key":"TAT","latE6":[53600000,0,0,0,0,0],"lonE6":[-106000000,10000,10000,10000,10000,10000],"nid":"TAT","operator":"CN","owner":"Owner","status":"Operational","subdivisionName":"Theta A","subdivisionNid":"S8a","trackClass":"Main","trackName":"None","useType":"Freight"},{"chainId":"ch_e440f256cccd9906","key":"TBT","latE6":[53600000,0,0,0,0,0],"lonE6":[-105950000,10000,10000,10000,10000,10000],"nid":"TBT","operator":"CN","owner":"Owner","status":"Operational","subdivisionName":"Theta B","subdivisionNid":"S8b","trackClass":"Main","trackName":"None","useType":"Freight"}]}
